{
  "schemaVersion": "1.0",
  "messageId": "4b2a90c9-4b50-40e8-8969-f594b9fde602",
  "correlationId": "6b7a9fa7-e3f0-4c5c-86cc-3914f42b262f",
  "requestId": "7afe6cba-7916-40e1-91dc-666f40f760db",
  "messageType": "url_scan.request",
  "sentAt": "2026-07-28T10:15:30.123Z",
  "source": "extension",
  "context": {
    "deviceId": null,
    "tabId": "384",
    "url": "https://example.com/account?step=1"
  },
  "outcome": null,
  "payload": {
    "originalUrl": "https://example.com/account?step=1"
  }
}
