{
  "schemaVersion": "1.0",
  "messageId": "d716521e-9f61-4d4c-8c87-b1acbdc67f1d",
  "correlationId": "6b7a9fa7-e3f0-4c5c-86cc-3914f42b262f",
  "requestId": "7afe6cba-7916-40e1-91dc-666f40f760db",
  "messageType": "url_scan.result",
  "sentAt": "2026-07-28T10:15:31.123Z",
  "source": "analyzer",
  "context": {
    "deviceId": "device-stable-id",
    "tabId": "384",
    "url": "https://example.com/account?step=1"
  },
  "outcome": {
    "status": "success",
    "result": { "riskScore": 72 }
  },
  "payload": {}
}
